{
  "checkpoint_note": "airgap.example/demo/audit\n50\n+Kbfu3a1nZ6fn9EW8O+3PdRUQe5ids6ohf2l1neBi+o=\npolicy sha256:3909f806c268773b10b6b3012a736a3efd183154ed4a2916f42488b9d877e8cd\ncode sha256:70246fe9350dfa879e74d5869760ffd9afc2c26aa72755e4238af8e9f098147e pcr0 -\n\n\u2014 airgap.example/demo/audit BeOAlFmsYc7q9S5wjqWiN1PPfPvBL6ZUTl/PK+NL7iWEhExVMgWdcV6EUBRc+VLNibuURCtAGkTDI7DYjrwlu4tlQgI=\n\u2014 airgap.example/demo/w1 ouRrogAAAABq1iC0sy4e9cyIgBnEyfpRWwHzveIMAL7gSi8YfYWhJEgdU3ZFUzLtUg7AFDe+M7f4hh8h7aZ7h0yPjx/5lQWWnOALBg==\n",
  "entry": {
    "actor": "executor",
    "data": {
      "amount_minor": 12500050,
      "authorization": {
        "kind": "stepup",
        "nonce": "DD9A9336",
        "signer_address": "0x6a7438740dc3289067175efda02459170dc1317d"
      },
      "currency": "CZK",
      "iban": "CZ6203000000000123456789",
      "proposal_id": "prp_4",
      "tx_id": "tx_2eb98a78b7a2d1b9",
      "vendor_id": "ven_87654321"
    },
    "facts_digest": "bfbfcd03e1d7683405536e1ce65bddbf0430160e4230d148c87ebdef9f585afb",
    "hints_digest": "631e8cd75e797f335b6c767c10f6c11a3cd0eb30e9716f1642aa87d5fbdcc468",
    "inputs_digest": "af43d3c1a4b8cbe9796fab8b3ad2e0b1979d4f81a4111ffa859f00a01215f186",
    "log_id": "audit",
    "policy_hash": "3909f806c268773b10b6b3012a736a3efd183154ed4a2916f42488b9d877e8cd",
    "seq": 47,
    "subject_id": "prp_4",
    "ts": "2026-10-19T13:52:42.764Z",
    "type": "execution",
    "v": 2
  },
  "inclusion_proof": [
    "6b6d8822ecebc1a7b3dd49a23321a5abcefbd0c6d742c23caab2ba2b68e2de3e",
    "29f97f7550eb8709e4ac94f5bddb3db4df5805b63af4c8a689e58a9507e3d0a7",
    "64d6dd868100e44ca2fe2c06cb427737448cc887188fa6b94bb98cf9a041e924",
    "82330fd1c56515dfc12d175b7ebc97c6c0d12ed7ce916cfd3454d8f292e47469",
    "a446b714e67c207795ee20aeb036453dcf9a2dcd4ff93b270123dba6732ee362",
    "bb7411e8e4e8a3b8c579f8c451800b625d763969e1ad5e8dd7a05133ca92e360"
  ],
  "key_ids": {
    "log": "05e38094",
    "w1": "a2e46ba2"
  },
  "leaf_hash": "23aa161ea09b4c33c3c069dc50df86afbb8ea34ecd63b2d9dd7e8ca383235869",
  "seq": 47,
  "tree_size": 50,
  "tx": {
    "amount_minor": 12500050,
    "authorization": {
      "kind": "stepup",
      "nonce": "DD9A9336",
      "signer_address": "0x6a7438740dc3289067175efda02459170dc1317d"
    },
    "currency": "CZK",
    "executed_at": "2026-10-19T13:52:42.764819Z",
    "iban": "CZ6203000000000123456789",
    "proposal_id": "prp_4",
    "rail": {
      "status": "ACTC",
      "xml_c14n_sha256": "71bed551d39cbc8ef3294524f279f9b5fcf399efd3c1a80276b28bd3cadf407e"
    },
    "seq": 47,
    "tx_id": "tx_2eb98a78b7a2d1b9",
    "vendor_id": "ven_87654321",
    "vs": "1348579"
  },
  "vkeys": {
    "log": "airgap.example/demo/audit+05e38094+AYMB6t/Q61AckfFZgHBU50wiDz+u2PMzsCnuFTyhHJn2",
    "w1": "airgap.example/demo/w1+a2e46ba2+BAx0bd3NtelGOJf81qgBU3uIEEGhPwhQTFiG21pddB3q"
  }
}
