{
  "checkpoint_note": "airgap.example/demo/audit\n35\nFbGKWlRl7dVwQfpGhbpOJzV940HrMXL7P4E87DqRaPQ=\npolicy sha256:3909f806c268773b10b6b3012a736a3efd183154ed4a2916f42488b9d877e8cd\ncode sha256:4efb5fa41393c729a5d625a92c13b6ba28d8124bfd20903060e09b40063cea5e pcr0 -\n\n\u2014 airgap.example/demo/audit x//5esyE568lrOINolshkYl9RfDeREe45r2+xjlptN5j1ha45eNBbcEt+bzs1Fyh1l/tQXIrs+nO9a9zUsi1HXyiXAU=\n\u2014 airgap.example/demo/w1 XGiJdgAAAABq1hOtjz6KIz4qIDTz0y004f1ibCbUm4IaJFe6Yuub3oDneijlVNqqZ7/YagEAzxQ98ou83UCI8zn6ALChdyHxXAVWDg==\n",
  "entry": {
    "actor": "executor",
    "data": {
      "amount_minor": 12500050,
      "authorization": {
        "kind": "stepup",
        "nonce": "C71FD732",
        "signer_address": "0xf3858d47f2dae73342e54d856ab846c156264cf7"
      },
      "currency": "CZK",
      "iban": "CZ6203000000000123456789",
      "proposal_id": "prp_4",
      "tx_id": "tx_047f9128ce39e1bf",
      "vendor_id": "ven_87654321"
    },
    "facts_digest": "665aedf1bb5d9931bc7835f4933851bdea83303e49dc349118c1efc759f1501d",
    "hints_digest": "631e8cd75e797f335b6c767c10f6c11a3cd0eb30e9716f1642aa87d5fbdcc468",
    "inputs_digest": "eb386d6a6501dddfaa06569591b9f48e2930b3c6d9008e8d78495190afa4124e",
    "log_id": "audit",
    "policy_hash": "3909f806c268773b10b6b3012a736a3efd183154ed4a2916f42488b9d877e8cd",
    "seq": 32,
    "subject_id": "prp_4",
    "ts": "2026-10-19T12:00:00.000Z",
    "type": "execution",
    "v": 2
  },
  "inclusion_proof": [
    "66e115a837cd4f1b74aa16bac3407019fcdb968162d5f3cffbfd1d61b3c5d9f8",
    "8a17839924e8e989f5cde04ebb061a4b44632f7a46af02d7fab17720d05e5bf4",
    "f0ed7ef1c5f36bea78da7cdd54fb4f0dcbc06b461f4bd59939d6518b98198168"
  ],
  "key_ids": {
    "log": "c7fff97a",
    "w1": "5c688976"
  },
  "leaf_hash": "94e6c95d876ee07bb58b06bbdfbdc8cfb4c7bde59a7eb310101f6fb8212f6a62",
  "seq": 32,
  "tree_size": 35,
  "tx": {
    "amount_minor": 12500050,
    "authorization": {
      "kind": "stepup",
      "nonce": "C71FD732",
      "signer_address": "0xf3858d47f2dae73342e54d856ab846c156264cf7"
    },
    "currency": "CZK",
    "executed_at": "2026-10-19T12:00:00Z",
    "iban": "CZ6203000000000123456789",
    "proposal_id": "prp_4",
    "rail": {
      "status": "ACTC",
      "xml_c14n_sha256": "2925c1973cc517a0f7463b983eab6755360f87d4e97ea7be555986c6bb443295"
    },
    "seq": 32,
    "tx_id": "tx_047f9128ce39e1bf",
    "vendor_id": "ven_87654321",
    "vs": "1200009"
  },
  "vkeys": {
    "log": "airgap.example/demo/audit+c7fff97a+AfQhK/AJ45KZINL+iHnhHP8jvgdU7T70bXf+4kbv/8AL",
    "w1": "airgap.example/demo/w1+5c688976+BGBPxiuaT4LpfaLNKrbjHUhpXt9G783/pNLrr4Fd7Nw6"
  }
}
