{
  "checkpoint_note": "airgap.example/demo/audit\n47\nG1zD2F9Sqvo77I8ONI+ug9mTdIZsTC1Vrgdo2Z6l4nM=\npolicy sha256:3909f806c268773b10b6b3012a736a3efd183154ed4a2916f42488b9d877e8cd\ncode sha256:2f1a27e1ca4cc2e8c6f2193373ad5d1bebb9d2f55815e2e548827d7b0f3069d6 pcr0 -\n\n\u2014 airgap.example/demo/audit BeOAlOHBlSmCaDZO6Zph/BOV7hi6rqVPe2bnrvVwzZSZrDl4qX2h7d3aZh9ZNpCj8Xwxduh5wjri+9WubFxoRe3K/g4=\n\u2014 airgap.example/demo/w1 ouRrogAAAABq1jt2+T4EcUfvcdz6TtigsFEwuAToIf362QDqzFPA5q+wED1YMWkAb4E7+BO79n/3m+CN9FRJgtwFHXMRe/S5xDRADg==\n\u2014 airgap.example/demo/w2 0Q1ysQAAAABq1jt/Ftak4Jzq0GDdTNiDst+qBoOOAV74NaDVEKHdn1jixRu/swq0BGlUY9+ymugOJqQSbcpogUf0iu4Bl+bDIIBEAA==\n",
  "entry": {
    "actor": "executor",
    "data": {
      "amount_minor": 12500050,
      "authorization": {
        "kind": "stepup",
        "nonce": "6735E3A4",
        "signer_address": "0xd27e1d0cbfb015686365b9d02cebf86e55770534"
      },
      "currency": "CZK",
      "iban": "CZ6203000000000123456789",
      "proposal_id": "prp_4",
      "tx_id": "tx_a5eb4d7527cffa7c",
      "vendor_id": "ven_87654321"
    },
    "facts_digest": "5455100593546e9fccd3a41936ca03b06f5d429261cf8a768d6a93882662085f",
    "hints_digest": "631e8cd75e797f335b6c767c10f6c11a3cd0eb30e9716f1642aa87d5fbdcc468",
    "inputs_digest": "9fcf82ce4b58fd2f97e3084a54e80eaa33e7cd8f7d0a355e3024d4e6c3aabeff",
    "log_id": "audit",
    "policy_hash": "3909f806c268773b10b6b3012a736a3efd183154ed4a2916f42488b9d877e8cd",
    "seq": 44,
    "subject_id": "prp_4",
    "ts": "2026-10-19T15:47:01.851Z",
    "type": "execution",
    "v": 2
  },
  "inclusion_proof": [
    "b124e66d69d84a87c10cfda39d25db0b97a5cdee9cf8b204e5b054433993c32f",
    "4dccea3bdd4af509a17b70adf8c488ae3fbdc88a2c65abfa920dcce7b22387db",
    "14955bddf3604b59748cefccb235b631433e10cc9772795411aaebe22acfd7af",
    "d361d95ecb7d2def12b06bb806c8d95bedcf0b05d451f0cdf1eef892b9106513",
    "98ac820ab0cd14b1e2f993b3843809b5ef8f384834c6bf60d508e61c1afc17d6"
  ],
  "key_ids": {
    "log": "05e38094",
    "w1": "a2e46ba2"
  },
  "leaf_hash": "e306a59dc360732b7432dc60d48e3d407b9c61f334e1e5e630959d5cd7551bb0",
  "seq": 44,
  "tree_size": 47,
  "tx": {
    "amount_minor": 12500050,
    "authorization": {
      "kind": "stepup",
      "nonce": "6735E3A4",
      "signer_address": "0xd27e1d0cbfb015686365b9d02cebf86e55770534"
    },
    "currency": "CZK",
    "executed_at": "2026-10-19T15:47:01.851577Z",
    "iban": "CZ6203000000000123456789",
    "proposal_id": "prp_4",
    "rail": {
      "status": "ACTC",
      "xml_c14n_sha256": "908127ff25c16d4d9e409a99fe8f19db63bf6253dc2ab9484d6d49296b7b9067"
    },
    "seq": 44,
    "tx_id": "tx_a5eb4d7527cffa7c",
    "vendor_id": "ven_87654321",
    "vs": "1546569"
  },
  "vkeys": {
    "log": "airgap.example/demo/audit+05e38094+AYMB6t/Q61AckfFZgHBU50wiDz+u2PMzsCnuFTyhHJn2",
    "w1": "airgap.example/demo/w1+a2e46ba2+BAx0bd3NtelGOJf81qgBU3uIEEGhPwhQTFiG21pddB3q"
  }
}
